{
  "owner": "DataEngineering",
  "email_notifications": ["alerts-data-engineeri-aaaafmgsat75dpgg7nhr3tbcvu@samsara.org.slack.com"],
  "jobs": [
    {
      "name": "update",
      "cron": "0 0 1-23/3 * * ?",
      "regions": ["us-west-2", "eu-west-1", "ca-central-1"],
      "timeout_seconds": 10800,
      "driver_node_type_id": "md-fleet.xlarge",
      "node_type_id": "rd-fleet.2xlarge",
      "max_workers": 16,
      "spark_version": "default",
      "parameters": {
        "end_date": "",
        "start_date": ""
      }
    }
  ],
  "output": {
    "dbname": "dataprep",
    "tablename": "device_heartbeats",
    "type": "table",
    "schema": [
      {
        "name": "org_id",
        "type": "long"
      },
      {
        "name": "device_id",
        "type": "long"
      },
      {
        "name": "first_heartbeat_date",
        "type": "date"
      },
      {
        "name": "first_heartbeat_ms",
        "type": "long"
      },
      {
        "name": "last_heartbeat_date",
        "type": "date"
      },
      {
        "name": "last_heartbeat_ms",
        "type": "long"
      },
      {
        "name": "last_reported_bootcount",
        "type": "long"
      },
      {
        "name": "last_reported_build",
        "type": "string"
      },
      {
        "name": "last_reported_gateway_id",
        "type": "long"
      }
    ]
  }
}
